[
  {
    "id": "dark-angels",
    "name": "Dark Angels",
    "parent_faction_id": "adeptus-astartes",
    "game_version": {
      "edition": "11th",
      "dataslate": "pre-launch-provisional"
    },
    "keywords": [
      "Imperium",
      "Adeptus Astartes",
      "Dark Angels"
    ],
    "aliases": [],
    "logo_url": "https://cdn.jsdelivr.net/gh/Certseeds/wh40k-icon@be230023ff0755d19ffb1a1762658c711c2887f9/src/svgs/human_imperium/astartes_legion/dark-angels.svg",
    "external_refs": [
      {
        "namespace": "game-datacards",
        "id": "fa0e86ef-b5da-4510-9a9f-8cd86267bb6a"
      },
      {
        "namespace": "mfm",
        "id": "fa0e86ef-b5da-4510-9a9f-8cd86267bb6a"
      }
    ],
    "faction_rule_ids": [
      "combat-doctrines-dark-angels",
      "transhuman-strategist-dark-angels",
      "the-ravenwing-dark-angels",
      "the-deathwing-dark-angels"
    ],
    "army_construction_rules": [
      {
        "type": "faction-keyword-cohesion",
        "base_faction_keyword": "Adeptus Astartes",
        "additional_keyword_source": "chapter",
        "max_distinct": 1
      }
    ]
  }
]
