[
  {
    "id": "salamanders",
    "name": "Salamanders",
    "parent_faction_id": "adeptus-astartes",
    "game_version": {
      "edition": "11th",
      "dataslate": "pre-launch-provisional"
    },
    "keywords": [
      "Imperium",
      "Adeptus Astartes",
      "Salamanders"
    ],
    "aliases": [],
    "logo_url": "https://cdn.jsdelivr.net/gh/Certseeds/wh40k-icon@be230023ff0755d19ffb1a1762658c711c2887f9/src/svgs/human_imperium/astartes_legion/salamanders.svg",
    "external_refs": [
      {
        "namespace": "mfm",
        "id": "4db683fe-87a0-4138-9b53-4b326c8e8521"
      }
    ],
    "faction_rule_ids": [
      "combat-doctrines-assault-force-adeptus-astartes"
    ],
    "army_construction_rules": [
      {
        "type": "faction-keyword-cohesion",
        "base_faction_keyword": "Adeptus Astartes",
        "additional_keyword_source": "chapter",
        "max_distinct": 1
      }
    ]
  }
]
